{
  "appeared_at": "2016-09-26T00:00:00.000Z",
  "created_at": "2017-02-15T16:13:32.456Z",
  "quote_id": "GYDdK40iSrSiyVAm2J_TKQ",
  "tags": [
    "Mexico",
    "Wall"
  ],
  "updated_at": "2017-02-15T16:13:32.456Z",
  "value": "I will build a great wall.",
  "_links": {},
  "_embedded": {
    "author": [
      {}
    ],
    "source": [
      {}
    ]
  }
}